{
  "$schema": "https://json-schema.org/draft/2020-12/schema",
  "$id": "https://solid-sdd.dev/schemas/verification-report.schema.json",
  "title": "VerificationReport",
  "description": "Output of solidsdd.verify (Phase 2 adds loop_action / failure_class).",
  "type": "object",
  "additionalProperties": false,
  "required": ["version", "result", "checks"],
  "properties": {
    "version": {
      "type": "string",
      "const": "1"
    },
    "change_id": {
      "type": "string",
      "pattern": "^[a-z0-9]+(-[a-z0-9]+)*$",
      "minLength": 3,
      "maxLength": 48,
      "description": "Optional but recommended: active change_id this report belongs to."
    },
    "result": {
      "type": "string",
      "enum": ["pass", "fail"]
    },
    "checks": {
      "type": "array",
      "items": {
        "$ref": "#/$defs/check"
      }
    },
    "suggested_next_skills": {
      "type": "array",
      "items": {
        "type": "string"
      },
      "description": "Skills to re-run on failure, e.g. solidsdd-apply-api, solidsdd-implement."
    },
    "loop_action": {
      "type": "string",
      "enum": ["retry", "human_gate", "stop"],
      "description": "What solidsdd-loop should do after a fail (omit on pass)."
    },
    "failure_class": {
      "$ref": "#/$defs/failure_class"
    }
  },
  "$defs": {
    "failure_class": {
      "type": "string",
      "enum": [
        "implementation_bug",
        "contract_gap",
        "tooling",
        "unknown"
      ]
    },
    "check": {
      "type": "object",
      "additionalProperties": false,
      "required": ["name", "kind", "result"],
      "properties": {
        "name": { "type": "string" },
        "kind": {
          "type": "string",
          "enum": ["openapi", "graphql", "ocl_tests", "formal", "other"]
        },
        "result": {
          "type": "string",
          "enum": ["pass", "fail", "skipped"]
        },
        "detail": { "type": "string" },
        "covers": {
          "type": "array",
          "items": { "type": "string" },
          "description": "WorkPlan item ids (e.g. W1) and/or Brief scope ids this check exercises."
        },
        "failure_class": {
          "$ref": "#/$defs/failure_class"
        }
      }
    }
  }
}
